,Title,Summary,Name
375,I.F.T.,"Walt has moved back into the house without Skyler's consent. Now she can't get him out. Meanwhile, Jesse continues to cope with Jane's death.",Breaking Bad
376,Green Light,"Walt's world crumbles even more after finding out that Skyler is cheating on him. Jesse tries to set up a meeting with Gus to try and sell his own version of the blue meth. Meanwhile, Hank is growing obsessed with finding Heisenberg.",Breaking Bad
377,Más,Gus tries to get Walt back in the business by offering him three million dollars and a brand new lab. Jesse is furious that Walt received half of the money for his blue meth. Hank tries to track down the RV meth lab.,Breaking Bad
378,Sunset,"Heisenberg's organized and practical assistant Gale greatly aids his work in Gus's lab. Hank finally tracks the RV back to Jesse, as a concerned Walt finds any way to erase the evidence.",Breaking Bad
379,One Minute,"Jesse ends up in the hospital after getting beaten up by Hank. Now he is threatening to press charges against the DEA. To stop him, Walt decides to bring Jesse on as his partner, once again.",Breaking Bad
380,I See You,Hank ends up in the hospital after being attacked by Tuco's cousins. Walt spends too much time by his family's side when he should be cooking meth.,Breaking Bad
381,Kafkaesque,"Skyler hatches a plan as Hank's hospital bills stack up. Meanwhile, Walt and Gus come to a better understanding as Jesse, looking for more independence, pursues a new opportunity.",Breaking Bad
382,Fly,There is a fly loose in the lab. Walt and Jesse must do whatever they can to kill it before it contaminates the meth.,Breaking Bad
383,Abiquiu,"Skyler gets more involved in Walt's business, much to his chagrin, as Hank struggles with his recovery. Meanwhile, Jesse takes an active role in his new enterprise, leading him to a startling discovery.",Breaking Bad
384,Half Measures,"Against Walt's advice, Jesse lashes out. Fearing for Jesse's safety, Walt takes drastic action to intervene. Meanwhile a tragic event leads to a shocking confrontation.",Breaking Bad
385,Full Measure,Jesse has disappeared and Walt is in big trouble with Gus. So Gus rehires Gale to learn from Walt's cooking so that they can dispose of Walt once and for all.,Breaking Bad
386,Box Cutter,"Walt and Jesse are held captive for Gus, after Gale's death. Meanwhile, Skyler tries to find out what happened to Walt.",Breaking Bad
387,Thirty-Eight Snub,"Walt attempts to form a new alliance as he plans his next move. Meanwhile Skyler pushes Walt towards a business opportunity, in hopes of protecting the family.",Breaking Bad
388,Open House,"While Walt worries about Gus's interference and Jesse's increasingly fragile state of mind, Skyler steps up the pressure to get what she wants.",Breaking Bad
389,Bullet Points,"As Skyler concocts an elaborate story to explain the Whites' finances, a worried Walt discovers that Hank has begun a new investigation.",Breaking Bad
390,Shotgun,"Jesse rides shotgun with Mike on a perilous run of pickups, prompting Walt to worry that his partner is about to be killed.",Breaking Bad
391,Cornered,"Skyler adopts an aloof approach when she suspects that Walt isn't telling her the truth. Meanwhile, Jesse proves his worth to Mike and Gus.",Breaking Bad
392,Problem Dog,"Skyler looks to continue her family's trend of appearing poverty-stricken by forcing Walt to return the car he bought. A concerned Walt chauffeurs Hank to Los Pollos Hermanos, and the articulate yet immobile DEA agent collects prints.",Breaking Bad
393,Hermanos,"When Hank produces evidence that Gus is Albuquerque's crystal meth kingpin, Walt worries that he and Jesse will be killed to protect their boss.",Breaking Bad
394,Bug,"While Walt tries to subvert Hank's probe into the Albuquerque meth scene, a deadly warning forces Gus to consider a deal with the cartel.",Breaking Bad
395,Salud,"Jesse, Gus, and Mike fly down to Mexico, and Jesse cooks the blue meth for the cartel. Walt misses his son's 16th birthday after his fight with Jesse.",Breaking Bad
396,Crawl Space,"Hank asks Walt to drive him to the laundry where the meth lab is hidden. Ted still won't pay the IRS so Skyler asks Saul for help, and Saul sends in his A-Team. Gus and Jesse return from Mexico, and Walt fears he is in trouble with Gus.",Breaking Bad
397,End Times,"The DEA is putting Hank and his family in protective custody; however, Walt refuses and awaits his fate in his house. Meanwhile, Brock has fallen terribly ill and Jesse suspects Walt may be behind it.",Breaking Bad
398,Face Off,"Jesse is brought to the FBI for questioning on his knowledge of ricin. In a last effort to kill Gus, Walt must ask for help from an old enemy.",Breaking Bad
399,Live Free or Die,"Now that Gus is dead, Walt, Jesse, and Mike work to cover their tracks. Skyler panics when Ted Beneke wakes up.",Breaking Bad
400,Madrigal,Walt and Jesse seek out an unlikely partner for a new business venture. The DEA follows up new leads in its investigation.,Breaking Bad
401,Hazard Pay,The guys put a business plan into action; Walt confesses to Marie.,Breaking Bad
402,Fifty-One,It's Walt's 51st birthday. His return to the drug business causes Skyler to go into depression.,Breaking Bad
403,Dead Freight,"Walter White's domestic life continues to deteriorate; at the same time, his growing business venture aims to steal a train car chock full of methylamine.",Breaking Bad
404,Buyout,"In the aftermath of the train heist, Jesse and Mike decide to quit the business, leaving Walt to handle things on his own. Mike is being followed by the DEA.",Breaking Bad
405,Say My Name,Mike and Jesse are out. Now Walt has to handle things on his own. Hank finally finds a rat in Mike's gang.,Breaking Bad
406,Gliding Over All,"Walt expands his business overseas, and the money is pouring in.",Breaking Bad
407,Blood Money,Walt is out of the meth business and trying to move on with his life. Jesse tries to get rid of his money. Hank now knows that Walt is the famous Heisenberg.,Breaking Bad
408,Buried,"Hank is determined to bring down Walt. Walt scrambles to hide evidence before Hank gets to it, and Skyler tries to stop Hank and Marie from taking away the kids.",Breaking Bad
409,Confessions,"Walt makes his next move against Hank, putting Hank in a tough position. Hank confronts Jesse and attempts to turn him against Walt, and Jesse decides it's time to move on. Meanwhile, Todd has taken over the business.",Breaking Bad
410,Rabid Dog,Walt discovers Jesse broke into his house and attempted to burn it down. Walt wants to protect his family so he moves them into a hotel for a few nights. Jesse makes plans to take down Walt.,Breaking Bad
411,To'hajiilee,Jesse and Hank come up with an idea to take Walt down. Walt hires Todd's uncle to kill Jesse.,Breaking Bad
412,Ozymandias,"Walt goes on the run. Jesse is taken hostage. Marie convinces Skyler to tell Walter, Jr. the truth.",Breaking Bad
413,Granite State,Walt struggles as he adapts to aspects of his new identity. Jesse plans an escape against Jack and his crew.,Breaking Bad
414,Felina,"Walter White makes one last attempt to secure his family's future, while also visiting some old enemies, during his final return to Albuquerque.",Breaking Bad
415,The One Where Monica Gets a Roommate: The Pilot,"Monica and the gang introduce Rachel to the ""real world"" after she leaves her fiancé at the altar.",Friends
416,The One with the Sonogram at the End,Ross finds out his ex-wife is pregnant. Rachel returns her engagement ring to Barry. Monica becomes stressed when her and Ross's parents come to visit.,Friends
417,The One with the Thumb,Monica becomes irritated when everyone likes her new boyfriend more than she does. Chandler resumes his smoking habit. Phoebe is given $7000 when she finds a thumb in a can of soda.,Friends
418,The One with George Stephanopoulos,"Joey and Chandler take Ross to a hockey game to take his mind off the anniversary of the first time he slept with Carol, while the girls become depressed when they realize they don't have a 'plan'.",Friends
419,The One with the East German Laundry Detergent,"Eager to spend time with Rachel, Ross pretends his washroom is rat-infested so he can join her at the laundromat. Meanwhile, Joey has Monica pose as his girlfriend, and Chandler struggles to break up with his girlfriend.",Friends
420,The One with the Butt,Monica's obsessiveness is put to the test after Rachel cleans the apartment. Joey lands a film role as Al Pacino's butt double. Chandler enjoys a relationship with all of the fun but none of the responsibility.,Friends
421,The One with the Blackout,"When New York suffers from a blackout, Ross tries to tell Rachel that he likes her, and Chandler gets stuck in an ATM vestibule with a model.",Friends
422,The One Where Nana Dies Twice,Monica and Ross mourn the loss of their grandmother. Chandler is shocked to find that people think he is gay.,Friends
423,The One Where Underdog Gets Away,The gang's plans for Thanksgiving go awry after they get locked out of Monica and Rachel's apartment.,Friends
424,The One with the Monkey,The gang make (and break) a pact not to bring dates to their New Years Eve party. Phoebe starts dating a scientist. Ross compensates for his loneliness by getting a monkey.,Friends
425,The One with Mrs. Bing,"Chandler's flamboyant romance-novelist mother comes to visit, and Joey catches her kissing Ross. Meanwhile, Monica and Phoebe fight over a guy in a coma.",Friends
426,The One with the Dozen Lasagnas,Rachel and Paolo's relationship hits a snag when he makes a pss at Phoebe. Ross refuses to find out the sex of his baby until it's born. Chandler and Joey go shopping for a new kitchen table.,Friends
427,The One with the Boobies,Joey finds out his dad has a mistress. Rachel tries to even the score after Chandler inadvertently catches a glimpse of her breasts. Phoebe dates a shrink who analyzes the gang.,Friends
428,The One with the Candy Hearts,"As Valentine's Day approaches; Ross and his date end up at the same restaurant as Carol and Susan, Joey inadvertently sets Chandler up on a blind date with Janice, and the girls burn mementos of their old boyfriends.",Friends
429,The One with the Stoned Guy,"Monica cooks a gourmet meal for a restaurateur who is looking for a new chef, however he arrives at the apartment stoned. Meanwhile, Ross tries to master 'dirty talk'.",Friends
430,The One with Two Parts: Part 1,Phoebe feels neglected when Joey falls for her twin sister. Chandler struggles to fire an attractive co-worker. Ross attends Lamaze classes with Carol and Susan.,Friends
431,The One with Two Parts: Part 2,"Rachel switches identities with Monica so she can use her health insurance. Meanwhile, Ursula continues to come between Phoebe and Joey.",Friends
432,The One with All the Poker,"As Rachel interviews for a new job, the girls take on the guys in a game of poker.",Friends
433,The One Where the Monkey Gets Away,The gang frantically search for Ross's monkey Marcel after Rachel loses him.,Friends
434,The One with the Evil Orthodontist,"Rachel and Barry start dating again, despite the fact that he's now engaged to Mindy; Chandler goes nuts when a woman he likes won't return his phone calls.",Friends
435,The One with the Fake Monica,Monica befriends the woman who stole her credit card. Ross is forced to give away Marcel. Joey tries to come up with a less ethnic-sounding stage name.,Friends
436,The One with the Ick Factor,Monica gets a shock when she finds out her boyfriend is a high school student. Chandler finds out his colleagues don't like him when Phoebe temps as his secretary.,Friends
437,The One with the Birth,"As Carol goes into labor; Ross and Susan argue, Rachel flirts with Carol's doctor, and Joey assists a pregnant single mother.",Friends
438,The One Where Rachel Finds Out,"As Ross leaves for China, Chandler accidentally reveals Ross's feelings for Rachel. Joey takes part in a fertility study and is unable to sleep with his new girlfriend.",Friends
439,The One with Ross's New Girlfriend,"Rachel waits for Ross at the airport, unaware he has a new girlfriend. Meanwhile, Chandler has a frightening experience with Joey's tailor, and Phoebe gives Monica a bad haircut.",Friends
440,The One with the Breast Milk,"Monica goes shopping with Julie and tries to keep it a secret from Rachel. Ross is grossed out by Carol's breast milk. At his day job, Joey competes with a fellow cologne spritzer.",Friends
441,The One Where Heckles Dies,"After Mr. Heckles dies and leaves all his belongings to Monica and Rachel, Chandler worries he will die alone just like him. Meanwhile, Phoebe and Ross argue over evolution.",Friends
442,The One with Phoebe's Husband,"When the gang find out Phoebe married a gay Canadian ice dancer for a green card, more of their secrets are revealed. Meanwhile, Rachel gives Ross bad advice on his relationship with Julie.",Friends
443,The One with Five Steaks and an Eggplant,"The gang are divided by income issues; Monica, Ross and Chandler have money, and Rachel, Phoebe and Joey don't.",Friends
444,The One with the Baby on the Bus,"Joey and Chandler are left to babysit Ben when Monica takes Ross to the hospital. Meanwhile, Phoebe loses her singing gig at Central Perk to a professional singer.",Friends
445,The One Where Ross Finds Out,"A drunken Rachel calls Ross and reveals her feelings for him on his answering machine. Meanwhile, Monica keeps busy by being Chandler's personal trainer and Phoebe constantly wonders why her current boyfriend won't sleep with her.",Friends
446,The One with the List,"With help from Chandler and Joey, Ross makes a list of pros and cons to decide whether to be with Julie or Rachel. Meanwhile, Monica gets a job making dessert with a disgusting synthetic chocolate substitute.",Friends
447,The One with Phoebe's Dad,"Phoebe tracks down her father, but isn't sure whether she should meet him. Ross asks Rachel to make a list of pros and cons about him.",Friends
448,The One with Russ,Monica gets back together with 'Fun Bobby' and realizes why he is always so upbeat. Rachel starts dating a guy called Russ who bears an uncanny resemblance to Ross.,Friends
449,The One with the Lesbian Wedding,Rachel's mom comes to visit with big news. Monica caters Carol and Susan's wedding. Phoebe becomes 'possessed' by the spirit of a recently deceased client.,Friends
450,The One After the Superbowl: Part 1,Ross goes to visit Marcel whilst on a trip to California and discovers he is working in commercials. Joey receives a fan letter from an attractive but unstable woman. Phoebe is asked to sing for children at a library.,Friends
451,The One After the Superbowl: Part 2,"Ross finds Marcel on the set of a new movie, where Chandler bumps into a former schoolmate. Meanwhile, Rachel and Monica compete for the affections of Jean-Claude Van Damme.",Friends
452,The One with the Prom Video,The gang watches a home video from the night of Monica and Rachel's prom. Joey gives Chandler a hideous bracelet.,Friends
453,The One Where Ross and Rachel... You Know,Monica becomes infatuated with a friend of her parents when she caters a party for him. Ross and Rachel go on their first date. Joey and Chandler refuse to move when they get a new TV and two armchairs.,Friends
454,The One Where Joey Moves Out,Joey and Chandler's friendship is jeopardized when Joey decides to move out. Monica worries about her parents finding out about her relationship with Richard when they attend a party together. Rachel and Phoebe go to get tattoos.,Friends
455,The One Where Eddie Moves In,"Chandler gets a new roommate. Phoebe gets the chance to make a music video for her song ""Smelly Cat"". Ross and Monica clash when he is always at her and Rachel's apartment.",Friends
456,The One Where Dr. Ramoray Dies,"Joey's soap opera character is killed off after he brags in an interview that he writes his own lines. Chandler is unnerved by Eddie's strange behavior, while Ross and Rachel compare their past lovers as do Richard and Monica.",Friends
457,The One Where Eddie Won't Go,"Chandler demands that Eddie move out; however, he doesn't seem to get the message. Meanwhile, a book on empowerment for women inspires the girls. In order to pay his bills, Ross convinces Joey to audition for a role he doesn't want.",Friends
458,The One Where Old Yeller Dies,Phoebe's world view is shattered when she learns how Old Yeller really ends. Monica becomes jealous when Richard starts hanging out with Chandler and Joey. Rachel panics when she learns that Ross has planned their whole life together.,Friends
459,The One with the Bullies,Chandler and Ross run into two bullies at Central Perk. Monica tries her luck at the stock market to avoid taking a job at a 1950s themed diner. Phoebe drives upstate for a second time to meet her father while Joey and Rachel accompany her.,Friends
460,The One with the Two Parties,"Chaos ensues when Rachel's recently divorced parents show up at her surprise birthday party, so the gang has to find ways to keep her parents separated otherwise they'll start fighting.",Friends
461,The One with the Chicken Pox,Phoebe catches chicken pox just as an old flame arrives in town on leave from the Navy. Joey gets a job at Chandler's office. Monica is upset that Richard doesn't have any quirks.,Friends
462,The One with Barry and Mindy's Wedding,Rachel reluctantly agrees to be maid of honor at her ex-fiancÃ© Barry's wedding. Monica ponders her future with Richard. Joey has to practice kissing guys to get a role in Warren Beatty's new movie but Ross and Chandler are unwilling to help him.,Friends
463,The One with the Princess Leia Fantasy,Monica suffers from insomnia and depression following her breakup with Richard. Joey struggles to accept Chandler and Janice's relationship. Ross confides in Rachel about one of his fantasies.,Friends
464,The One Where No One's Ready,"A stressed Ross desperately and insistently tries to get the rest of the gang ready for a black tie event at the museum, while Joey and Chandler clash over personal belongings and personal space.",Friends
465,The One with the Jam,Monica tries to get over Richard by using her free time to make jam and considers artificial insemination through a sperm bank. Phoebe is stalked by a man who mistakes her for Ursula.,Friends
466,The One with the Metaphorical Tunnel,Chandler tries to get over his fear of commitment. Phoebe poses as Joey's agent after she forgets to tell him about an audition. Ross panics after seeing Ben play with a Barbie doll and tries to convince him to play with more manly toys.,Friends
467,The One with Frank Jr.,Phoebe has trouble bonding with her half-brother Frank when he comes to visit. Joey attempts to build an entertainment center. Ross is challenged to name the five celebrities he'd like to sleep with most.,Friends
468,The One with the Flashback,"The gang remember the events three years ago, when several of them almost slept together.",Friends
469,The One with the Race Car Bed,"Joey becomes a learning extension teacher in soap acting, and loves the respect from even more clueless kids. Monica chooses a ridiculously cheap bed from Janice's ex; Phoebe signs for her ...                See full summaryÂ Â»",Friends
470,The One with the Giant Poking Device,Chandler is devastated after Joey tells him he saw Janice kissing her ex-husband. Monica accidentally bumps Ben's head into a post when she and Rachel babysit. Phoebe is paranoid if she goes to dentist someone she knows will die.,Friends
471,The One with the Football,"Old sibling rivalry between Monica and Ross resurfaces and postpones Thanksgiving dinner when the gang decide to play a game of ""touch"" football.",Friends
472,The One Where Rachel Quits,Ross accidentally breaks a little girl's leg and tries to help her sell boxes of cookies which recreates Monica's childhood fixation. Rachel quits her job at Central Perk and Joey's Christmas tree selling conflicts with Phoebe's principles.,Friends
473,The One Where Chandler Can't Remember Which Sister,A drunken Chandler fools around with one of Joey's sisters - but he can't remember which one. Ross becomes skeptical when a guy at the diner gets Rachel an interview for a position at Bloomingdales.,Friends
474,The One with All the Jealousy,"Ross becomes insanely jealous of Mark. Monica hooks up with a co-worker, who writes her a poem with a hidden meaning. One of Joey's numerous lies on his resume is exposed when he takes part in a Broadway production.",Friends
475,The One Where Monica and Richard Are Just Friends,"Monica's willpower is tested when she bumps into Richard. Joey and Rachel exchange their favorite books. Phoebe dates an athletic guy who doesn't realize he has a ""wardrobe malfunction"".",Friends
476,The One with Phoebe's Ex-Partner,"Phoebe is reunited with her former singing partner who thinks ""Smelly Cat"" has hit potential; Chandler dates a woman with a prosthetic leg.",Friends
477,The One Where Ross and Rachel Take a Break,Ross seeks solace at a party after a bitter fight with Rachel and ends up in the arms of another woman; Phoebe's date needs an interpreter to communicate.,Friends
478,The One with the Morning After,"Ross is guilt-ridden after sleeping with Chloe and desperately tries to stop Rachel from finding out and when she does, the rest of the gang listen to them argue and end up trapped in Monica's room for the rest of the night.",Friends
479,The One Without the Ski Trip,"Monica, Chandler, Phoebe and Joey become stuck in the middle of Ross and Rachel's fight following their break-up.",Friends
480,The One with the Hypnosis Tape,Monica goes out with a guy who turns out to be a software billionaire. Chandler's stop smoking hypnosis tape has an unexpected side effect. Frank makes a surprise announcement that he is getting married - to a woman twice his age.,Friends
481,The One with the Tiny T-Shirt,"Rachel goes on her first date, after splitting from Ross, with Mark. Joey clashes with his co-star in his new play. Monica continues to date Pete, even though she is still not attracted to him.",Friends
482,The One with the Dollhouse,"Monica's aunt dies and leaves her an antique dollhouse that she doesn't want Phoebe to play with; Rachel regrets setting up Chandler with her boss, Joanna.",Friends
483,The One with the Chick and the Duck,"Joey buys a chick for him and Chandler, Pete offers Monica a job at his restaurant but she is undecided if she should accept it. Ross shows his continued feelings for Rachel when he gives up being on TV for her.",Friends
484,The One with the Screamer,"Ross witnesses Rachel's date screaming at people. Meanwhile, Joey becomes upset when Kate is offered a job in Los Angeles; Phoebe refuses to hang up the phone when she is placed on hold by her phone company.",Friends
485,The One with Ross's Thing,Ross seeks medical help when he finds a mysterious skin condition on his backside. Phoebe struggles to choose between two guys; Monica can't decide what to do about Pete when she thinks he is going to propose.,Friends
486,The One with the Ultimate Fighting Champion,Monica struggles to support Pete in his goal to become the Ultimate Fighting Champion. Chandler is uneasy when his boss playfully slaps his butt. Rachel becomes jealous when Ross starts dating a woman that was introduced to him by Phoebe.,Friends
487,The One at the Beach,"While at the beach, Phoebe meets a family friend with links to her past; Ross discovers that Rachel still loves him and must decide between her and Bonnie.",Friends
488,The One with the Jellyfish,"Ross chooses between Rachel and his bald-headed girlfriend Bonnie; Joey, Chandler, and Monica have a perilous encounter with a jellyfish at the beach.",Friends
489,The One with the Cat,Phoebe becomes convinced that the spirit of her dead mother is inside a cat. Chandler and Joey are robbed. Monica goes on a date with a guy from her high school.,Friends
490,The One with the 'Cuffs,Monica tries to avoid criticism when she caters a party for her mother. Chandler ends up half naked and handcuffed to a chair in Rachel's boss's office. Joey tries to get educated from a salesman trying to sell him a set of encyclopedias.,Friends
491,The One with the Ballroom Dancing,Joey is forced to help Treeger learn how to dance after he threatens to have Monica and Rachel evicted. Phoebe develops a crush on one of her clients. Ross tries to help Chandler quit the gym.,Friends
492,The One with Joey's New Girlfriend,Chandler develops feelings for Joey's new girlfriend. Ross and Rachel try to make each other jealous with their dates. Phoebe's cold gives her a sexy singing voice.,Friends
493,The One with the Dirty Girl,Ross's new girlfriend is nearly perfect until he discovers her apartment is very dirty. Chandler buys a better birthday present for Kathy than Joey. Phoebe helps Monica cater an event. Rachel is obsessed at finishing a crossword puzzle by herself.,Friends
494,The One Where Chandler Crosses the Line,Chandler is guilt-ridden after kissing Kathy. Ross starts playing the keyboard again and everyone except Phoebe thinks he's terrible. Joey dates someone else while still attached to Kathy.,Friends
495,The One with Chandler in a Box,Chandler tries to earn Joey's forgiveness by lying in a wooden box for six hours. Monica accidentally gets ice in her eye and her doctor turns out to be Richard's son and it's discovered Rachel exchanges the gifts she received in the past.,Friends
496,The One Where They're Going to Party!,Monica ends up having to choose between a head chef position or the catering business she started with Phoebe. Rachel is close to getting a promotion but tragedy strikes. Chandler and Ross are excited when an old friend is coming to town.,Friends
