,Title,Summary,Name
0,Winter Is Coming,Eddard Stark is torn between his family and an old friend when asked to serve at the side of King Robert Baratheon; Viserys plans to wed his sister to a nomadic warlord in exchange for an army.,Games of Throne
1,The Kingsroad,"While Bran recovers from his fall, Ned takes only his daughters to King's Landing. Jon Snow goes with his uncle Benjen to the Wall. Tyrion joins them.",Games of Throne
2,Lord Snow,Jon begins his training with the Night's Watch; Ned confronts his past and future at King's Landing; Daenerys finds herself at odds with Viserys.,Games of Throne
3,"Cripples, Bastards, and Broken Things","Eddard investigates Jon Arryn's murder. Jon befriends Samwell Tarly, a coward who has come to join the Night's Watch.",Games of Throne
4,The Wolf and the Lion,"Catelyn has captured Tyrion and plans to bring him to her sister, Lysa Arryn, at the Vale, to be tried for his, supposed, crimes against Bran. Robert plans to have Daenerys killed, but Eddard refuses to be a part of it and quits.",Games of Throne
5,A Golden Crown,"While recovering from his battle with Jaime, Eddard is forced to run the kingdom while Robert goes hunting. Tyrion demands a trial by combat for his freedom. Viserys is losing his patience with Drogo.",Games of Throne
6,You Win or You Die,"Robert has been injured while hunting and is dying. Jon and the others finally take their vows to the Night's Watch. A man, sent by Robert, is captured for trying to poison Daenerys. Furious, Drogo vows to attack the Seven Kingdoms.",Games of Throne
7,The Pointy End,The Lannisters press their advantage over the Starks; Robb rallies his father's northern allies and heads south to war; The White Walkers attack the Wall; Tyrion returns to his father with some new friends.,Games of Throne
8,Baelor,Robb goes to war against the Lannisters. Jon finds himself struggling on deciding if his place is with Robb or the Night's Watch. Drogo has fallen ill from a fresh battle wound. Daenerys is desperate to save him.,Games of Throne
9,Fire and Blood,Robb vows to get revenge on the Lannisters. Jon must officially decide if his place is with Robb or the Night's Watch. Daenerys says her final goodbye to Drogo.,Games of Throne
10,The North Remembers,Tyrion arrives at King's Landing to take his father's place as Hand of the King. Stannis Baratheon plans to take the Iron Throne for his own. Robb tries to decide his next move in the war. The Night's Watch arrive at the house of Craster.,Games of Throne
11,The Night Lands,"Arya makes friends with Gendry. Tyrion tries to take control of the Small Council. Theon arrives at his home, Pyke, in order to persuade his father into helping Robb with the war. Jon tries to investigate Craster's secret.",Games of Throne
12,What Is Dead May Never Die,Tyrion tries to see who he can trust in the Small Council. Catelyn visits Renly to try and persuade him to join Robb in the war. Theon must decide if his loyalties lie with his own family or with Robb.,Games of Throne
13,Garden of Bones,"Lord Baelish arrives at Renly's camp just before he faces off against Stannis. Daenerys and her company are welcomed into the city of Qarth. Arya, Gendry, and Hot Pie find themselves imprisoned at Harrenhal.",Games of Throne
14,The Ghost of Harrenhal,"Tyrion investigates a secret weapon that King Joffrey plans to use against Stannis. Meanwhile, as a token for saving his life, Jaqen H'ghar offers to kill three people that Arya chooses.",Games of Throne
15,The Old Gods and the New,"Theon seizes control of Winterfell. Jon captures a wildling, named Ygritte. The people of King's Landing begin to turn against King Joffrey. Daenerys looks to buy ships to sail for the Seven Kingdoms.",Games of Throne
16,A Man Without Honor,Bran and Rickon have escaped Winterfell. Theon tries to hunt them down. Daenerys' dragons have been stolen. Jon travels through the wilderness with Ygritte as his prisoner. Sansa has bled and is now ready to have Joffrey's children.,Games of Throne
17,The Prince of Winterfell,"Stannis is just days from King's Landing. Tyrion prepares for his arrival. Jon and Qhorin are taken prisoner by the wildlings. Catelyn is arrested for releasing Jaime. Arya, Gendry, and Hot Pie plan to escape from Harrenhal.",Games of Throne
18,Blackwater,Stannis Baratheon's fleet and army arrive at King's Landing and the battle for the city begins. Cersei plans for her and her children's future.,Games of Throne
19,Valar Morghulis,Joffrey puts Sansa aside for Margaery Tyrell. Robb marries Talisa Maegyr. Jon prepares to meet Mance Rayder. Arya says farewell to Jaqen H'ghar. Daenerys tries to rescue her dragons.,Games of Throne
20,Valar Dohaeris,"Jon is brought before Mance Rayder, the King Beyond the Wall, while the Night's Watch survivors retreat south. In King's Landing, Tyrion asks for his reward. Littlefinger offers Sansa a way out.",Games of Throne
21,"Dark Wings, Dark Words","Bran and company meet Jojen and Meera Reed. Arya, Gendry, and Hot Pie meet the Brotherhood. Jaime travels through the wilderness with Brienne. Sansa confesses her true feelings about Joffery to Margaery.",Games of Throne
22,Walk of Punishment,Robb and Catelyn arrive at Riverrun for Lord Hoster Tully's funeral. Tywin names Tyrion the new Master of Coin. Arya says goodbye to Hot Pie. The Night's Watch returns to Craster's. Brienne and Jaime are taken prisoner.,Games of Throne
23,And Now His Watch Is Ended,Jaime mopes over his lost hand. Cersei is growing uncomfortable with the Tyrells. The Night's Watch is growing impatient with Craster. Daenerys buys the Unsullied.,Games of Throne
24,Kissed by Fire,"Robb's army is falling apart. Jaime reveals a story, to Brienne, that he has never told anyone. Jon breaks his vows. The Hound is granted his freedom. The Lannisters hatch a new plan.",Games of Throne
25,The Climb,Jon and the wildlings scale the Wall. The Brotherhood sells Gendry to Melisandre. Robb does what he can to win back the Freys. Tyrion tells Sansa about their engagement.,Games of Throne
26,The Bear and the Maiden Fair,Jon and the wildlings travel south of the Wall. Talisa tells Robb that she's pregnant. Arya runs away from the Brotherhood. Daenerys arrives at Yunkai. Jaime leaves Brienne behind at Harrenhal.,Games of Throne
27,Second Sons,Daenerys tries to persuade the Second Sons to join her against Yunkai. Stannis releases Davos from the dungeons. Sam and Gilly are attacked by a White Walker. Sansa and Tyrion wed.,Games of Throne
28,The Rains of Castamere,Robb and Catelyn arrive at the Twins for the wedding. Jon is put to the test to see where his loyalties truly lie. Bran's group decides to split up. Daenerys plans an invasion of Yunkai.,Games of Throne
29,Mhysa,Bran and company travel beyond the Wall. Sam returns to Castle Black. Jon says goodbye to Ygritte. Jaime returns to King's Landing. The Night's Watch asks for help from Stannis.,Games of Throne
30,Two Swords,"Tyrion welcomes a guest to King's Landing. At Castle Black, Jon stands trial. Daenerys is pointed to Meereen, the mother of all slave cities. Arya runs into an old enemy.",Games of Throne
31,The Lion and the Rose,Joffrey and Margaery's wedding has come. Tyrion breaks up with Shae. Ramsay tries to prove his worth to his father. Bran and company find a Weirwood tree.,Games of Throne
32,Breaker of Chains,Tyrion is arrested for the murder of Joffrey and awaits trial. Sansa escapes King's Landing. Sam sends Gilly to Mole's Town as the Night's Watch finds itself in a tight spot. Meereen challenges Daenerys.,Games of Throne
33,Oathkeeper,Jaime entrusts a task to Brienne. Daenerys frees Meereen. Jon is given permission to lead a group of Night's Watchmen to Craster's Keep. Bran and company are taken hostage.,Games of Throne
34,First of His Name,Tommen is crowned King of the Seven Kingdoms. Cersei builds her case against Tyrion. Sansa and Lord Baelish arrive at the Eyrie. The Night's Watch attacks Craster's Keep.,Games of Throne
35,The Laws of Gods and Men,Tyrion's trial has come. Yara and her troops storm the Dreadfort to free Theon. Daenerys meets Hizdar zo Loraq. Stannis makes a deal with the Iron Bank of Braavos.,Games of Throne
36,Mockingbird,Tyrion tries to find a champion. Daenerys sleeps with Daario. The Hound becomes wounded. Jon's advice is ignored at Castle Black. Brienne and Podrick receive a tip on Arya's whereabouts.,Games of Throne
37,The Mountain and the Viper,"Theon helps Ramsay seize Moat Cailin. The wildlings attack Mole's Town. Sansa comes up with a story to protect Lord Baelish. Daenerys finds out a secret about Jorah Mormont. Oberyn Martell faces Gregor Clegane, the Mountain.",Games of Throne
38,The Watchers on the Wall,The battle between the Night's Watch and the wildlings has come.,Games of Throne
39,The Children,"Jon makes an important decision. Daenerys experiences new consequences. Brienne and Podrick have an unexpected encounter. Bran achieves a goal, while Tyrion makes an important discovery.",Games of Throne
40,The Wars to Come,"Cersei and Jaime adjust to a world without Tywin. Tyrion and Varys arrive at Pentos. In Meereen, a new enemy emerges. Jon is caught between two kings.",Games of Throne
41,The House of Black and White,Arya arrives in Braavos. Jaime takes on a secret mission. Ellaria Sand seeks revenge for Oberyn's death. Stannis makes Jon a generous offer as the Night's Watch elects a new Lord Commander. Daenerys is faced with a difficult decision.,Games of Throne
42,High Sparrow,Tommen and Margaery wed. Arya has trouble adapting to her new life. Littlefinger reveals his plans to Sansa. Jon gives his first orders as Lord Commander. Tyrion and Varys arrive in Volantis.,Games of Throne
43,Sons of the Harpy,"Jorah Mormont sets sail alongside his prisoner, Tyrion. Cersei makes a move against the Tyrells. Jaime and Bronn sneak into Dorne. Ellaria and the Sand Snakes make their plans. Melisandre tempts Jon. The Harpies attack.",Games of Throne
44,Kill the Boy,Daenerys arrests the heads of Meereen's great families. Jon makes a difficult decision. Theon is forced to face Sansa. Stannis rides south. Tyrion and Jorah enter the ruins of Old Valyria.,Games of Throne
45,"Unbowed, Unbent, Unbroken",Arya is put to the test. Tyrion and Jorah are captured by slavers. Loras Tyrell is judged by the Sparrows. Jaime and Bronn face the Sand Snakes. Sansa marries Ramsay Bolton.,Games of Throne
46,The Gift,Jon heads east as trouble begins to stir for Sam and Gilly at Castle Black. Sansa asks Theon for help. Tyrion and Jorah are sold as slaves. Cersei savors her triumph over the Tyrells as new plots are developed in the shadows.,Games of Throne
47,Hardhome,Tyrion advises Daenerys. Sansa forces Theon to tell her a secret. Cersei remains stubborn. Arya meets her first target. Jon and Tormund meet with the wildling elders.,Games of Throne
48,The Dance of Dragons,Jon and the wildlings return to Castle Black. Jaime meets with Doran Martell. Stannis makes a hard choice. Arya runs into Meryn Trant. Daenerys attends the grand reopening of the fighting pits.,Games of Throne
49,Mother's Mercy,Stannis arrives at Winterfell. Tyrion runs Meereen as Daario and Jorah go after Daenerys. Jaime and Myrcella leave Dorne. Jon sends Sam and Gilly to Oldtown. Arya challenges the Many-Faced God. Cersei confesses her sins.,Games of Throne
50,The Red Woman,The fate of Jon Snow is revealed. Daenerys is brought before Khal Moro. Tyrion gets used to living in Meereen. Ramsay sends his dogs after Theon and Sansa. Ellaria and the Sand Snakes make their move. Cersei mourns for Myrcella.,Games of Throne
51,Home,Bran trains with the Three-Eyed Raven. Tommen meets with Cersei. Tyrion makes a bold move. Theon leaves while at Pyke new issues arise. Ramsay's brother is born. Davos asks Melisandre for a miracle.,Games of Throne
52,Oathbreaker,"Daenerys arrives at Vaes Dothrak. Sam and Gilly sail for Horn Hill. Arya trains as No One. Varys finds information on the Sons of the Harpy. Ramsay receives a gift. Tommen meets with the High Sparrow. At Castle Black, a miracle occurs.",Games of Throne
53,Book of the Stranger,Sansa arrives at Castle Black. Tyrion makes a deal with the slave masters. Jorah and Daario sneak into Vaes Dothrak. Ramsay sends a letter to Jon. Theon arrives at Pyke. Cersei and Olenna Tyrell plot against the High Sparrow.,Games of Throne
54,The Door,Sansa and Jon make plans. Arya is given another chance to prove herself. Jorah confesses a secret to Daenerys. Tyrion meets with a red priestess. Yara finds her rule tested. Bran discovers the origin of the White Walkers.,Games of Throne
55,Blood of My Blood,Bran and Meera find a new ally. Gilly meets Sam's family. Arya makes a difficult choice. The Lannisters and Tyrells march against the High Sparrow.,Games of Throne
56,The Broken Man,Jon and Sansa gather troops. Jaime arrives at Riverrun. Olenna Tyrell plans to leave King's Landing. Theon and Yara plan a destination. Arya makes plans to leave.,Games of Throne
57,No One,Brienne arrives at Riverrun. Arya seeks shelter. Jaime meets with Edmure Tully. Cersei challenges the Faith. Sandor Clegane hunts for revenge. Tyrion faces the consequences of earlier decisions.,Games of Throne
58,Battle of the Bastards,Jon and Sansa face Ramsay Bolton on the fields of Winterfell. Daenerys strikes back at her enemies. Theon and Yara arrive in Meereen.,Games of Throne
59,The Winds of Winter,Cersei and Loras Tyrell stand trial by the gods. Daenerys prepares to set sail for Westeros. Davos confronts Melisandre. Sam and Gilly arrive in the Citadel. Bran discovers a long-kept secret. Lord Frey has an uninvited guest.,Games of Throne
60,Dragonstone,"Jon organizes the North's defenses. Cersei tries to even the odds. Daenerys comes home. Arya reminds the Freys ""the North remembers."" Sam adapts to life in Oldtown. The Night King makes his way south.",Games of Throne
61,Stormborn,Daenerys receives an unexpected visitor. Jon faces resistance. Tyrion plans the conquest of Westeros. Cersei gathers her allies. Arya has a reunion with old friends. Sam risks his career and life.,Games of Throne
62,The Queen's Justice,Jon and Daenerys finally meet. Cersei gains a new ally. Sansa receives an unexpected visitor. Sam is confronted for his actions.,Games of Throne
63,The Spoils of War,Daenerys takes matters into her own hands. Arya reaches her destination. Jaime and Bronn collect the spoils from the war with the Tyrells.,Games of Throne
64,Eastwatch,Daenerys demands loyalty from the surviving Lannister soldiers; Jon heeds Bran's warning about White Walkers on the move; Cersei vows to vanquish anyone or anything that stands in her way.,Games of Throne
65,Beyond the Wall,Jon and his team go beyond the wall to capture a wight. Daenerys has to make a tough decision.,Games of Throne
66,The Dragon and the Wolf,"Everyone meets in King's Landing to discuss the fate of the realm. In Winterfell, Sansa confronts Arya. Sam reaches Winterfell, where he and Bran discover a shocking secret about Jon Snow.",Games of Throne
67,Winterfell,Jon and Daenerys arrive in Winterfell and are met with skepticism. Sam learns about the fate of his family. Cersei gives Euron the reward he aims for. Theon follows his heart.,Games of Throne
68,A Knight of the Seven Kingdoms,Jaime faces judgment and Winterfell prepares for the battle to come.,Games of Throne
69,The Long Night,The Night King and his army have arrived at Winterfell and the great battle begins.,Games of Throne
70,The Last of the Starks,The Battle of Winterfell is over and a new chapter for Westeros begins.,Games of Throne
71,The Bells,Forces have arrived at King's Landing for the final battle.,Games of Throne
72,The Iron Throne,"In the aftermath of the devastating attack on King's Landing, Daenerys must face the survivors.",Games of Throne
73,Unaired Pilot,"The first Pilot of what will become ""The Big Bang Theory"". Leonard and Sheldon are two awkward scientists who share an apartment. They meet a drunk girl called Katie and invite her to stay at their place, because she has nowhere to stay. The two guys have a female friend, also a scientist, called Gilda.",Big Bang Theory
74,Pilot,"A pair of socially awkward theoretical physicists meet their new neighbor Penny, who is their polar opposite.",Big Bang Theory
75,The Big Bran Hypothesis,Penny is furious with Leonard and Sheldon when they sneak into her apartment and clean it while she is sleeping.,Big Bang Theory
76,The Fuzzy Boots Corollary,"Leonard gets upset when he discovers that Penny is seeing a new guy, so he tries to trick her into going on a date with him.",Big Bang Theory
77,The Luminous Fish Effect,Sheldon's mother is called to intervene when he delves into numerous obsessions after being fired for being disrespectful to his new boss.,Big Bang Theory
78,The Hamburger Postulate,"Leslie seduces Leonard, but afterwards tells him that she is only interested in a one-night stand.",Big Bang Theory
79,The Middle Earth Paradigm,"The guys are invited to Penny's Halloween party, where Leonard has yet another run-in with Penny's ex-boyfriend Kurt.",Big Bang Theory
80,The Dumpling Paradox,"When Howard hooks up with Penny's old friend, his absence in the gang causes problems for the rest of the guys.",Big Bang Theory
81,The Grasshopper Experiment,"When Raj's parents set him up on a blind date, he finds he can talk to women with the aid of alcohol.",Big Bang Theory
82,The Cooper-Hofstadter Polarization,"Leonard and Sheldon's friendship is put to the test when Leonard wants to present a paper they co-authored at a physics convention, but Sheldon doesn't.",Big Bang Theory
83,The Loobenfeld Decay,"Leonard lies to Penny so that he and Sheldon can get out of watching her perform. However, Sheldon believes that the lie has too many loose ends, so he comes up with a new, unnecessarily complex one to replace it.",Big Bang Theory
84,The Pancake Batter Anomaly,"When Sheldon gets sick, Leonard, Howard and Raj go AWOL, leaving a reluctant Penny to deal with him.",Big Bang Theory
85,The Jerusalem Duality,"Sheldon decides to give up his work and focus on other tasks when a 15-year-old prodigy joins the university, so the other guys come up with a plan to get rid of him.",Big Bang Theory
86,The Bat Jar Conjecture,"Sheldon becomes so intent on demonstrating his intellectual superiority over the other guys that they kick him off the Physics Bowl team and replace him with his nemesis, Leslie.",Big Bang Theory
87,The Nerdvana Annihilation,"Penny gets mad at the guys when their full scale model of a time machine causes her to miss work, which prompts Leonard to give up all of his nerd memorabilia.",Big Bang Theory
88,The Pork Chop Indeterminacy,"Leonard, Howard and Raj fight over Sheldon's twin sister when she arrives in town. Raj takes part in a drug trial to suppress his selective mutism.",Big Bang Theory
89,The Peanut Reaction,"When Penny learns that Leonard has never had a birthday party, she and the rest of the guys plan a surprise party for him.",Big Bang Theory
90,The Tangerine Factor,"After a bad breakup, Penny finally agrees to go out on a date with Leonard, however they both develop doubts and turn to Sheldon for advice.",Big Bang Theory
91,The Bad Fish Paradigm,"Leonard becomes concerned when his date with Penny ends abruptly and she starts blowing him off. When told the truth, Sheldon would rather move out than keep Penny's reasons a secret from Leonard.",Big Bang Theory
92,The Codpiece Topology,Sheldon is annoyed when Leonard turns to Leslie for comfort after seeing Penny with another guy.,Big Bang Theory
93,The Barbarian Sublimation,"Sheldon introduces Penny to online gaming, however she refuses to quit after becoming addicted.",Big Bang Theory
94,The Griffin Equivalency,The guys struggle to cope with Raj's arrogance after he is featured in a People magazine article.,Big Bang Theory
95,The Euclid Alternative,"Sheldon annoys the gang when Leonard can't drive him to and from work, so they try to teach him how to drive.",Big Bang Theory
96,The Cooper-Nowitzki Theorem,"Sheldon is flattered when a graduate student takes a shine to him, however her extreme devotion becomes too much to handle.",Big Bang Theory
97,The Panty Piñata Polarization,"Penny plans revenge when Sheldon bans her from his and Leonard's apartment, while Howard and Raj use the latest technology to try to find the house being used in ""America's Next Top Model.""",Big Bang Theory
98,The Lizard-Spock Expansion,Leonard and Howard's friendship is jeopardised when Leonard steals a girl from Howard.,Big Bang Theory
99,The White Asparagus Triangulation,"Sheldon believes that Leonard will wreck his relationship with Stephanie, so he decides to take matters into his own hands.",Big Bang Theory
100,The Vartabedian Conundrum,"Leonard tries to slow down his relationship with Stephanie when he realizes that they are living together, while Sheldon becomes convinced that he has an untraceable disease.",Big Bang Theory
101,The Bath Item Gift Hypothesis,"Leonard is disappointed when Penny develops an interest in an attractive physicist at the university. Meanwhile, Sheldon struggles to find an appropriate Christmas gift for Penny.",Big Bang Theory
102,The Killer Robot Instability,"Howard becomes depressed after Penny makes a cruel statement about his love life, while the rest of the guys prepare for a grudge killer robot duel against an obnoxious colleague at the university.",Big Bang Theory
103,The Friendship Algorithm,Sheldon tries to make friends with Kripke in the hope that it will get him access to a coveted computer at the university.,Big Bang Theory
104,The Financial Permeability,Leonard and Sheldon try to help out Penny when she can't afford to pay her rent.,Big Bang Theory
105,The Maternal Capacitance,"Sheldon hits it off with Leonard's psychoanalyst mother, but she drives Leonard and Penny to the bottle.",Big Bang Theory
106,The Cushion Saturation,"Howard hooks up with Leslie, while Penny accidentally ruins Sheldon's spot on the couch.",Big Bang Theory
107,The Terminator Decoupling,"On a train to San Francisco, Howard, Raj and Leonard fight for the affections of sci-fi star Summer Glau, while Sheldon is forced to turn to Penny for help when he leaves his flash drive behind.",Big Bang Theory
108,The Work Song Nanocluster,Sheldon's assistance with Penny's home-based business leads to chaos.,Big Bang Theory
109,The Dead Hooker Juxtaposition,Penny becomes jealous when a gorgeous new neighbor attracts the guys' attention.,Big Bang Theory
110,The Hofstadter Isotope,"Leonard is upset when the owner of the comic book store goes on a date with Penny, so he convinces Howard and Raj to take him to a bar so that he can pick up a woman of his own.",Big Bang Theory
111,The Vegas Renormalization,"After being dumped by Leslie, Howard heads to Las Vegas with Leonard and Raj. Meanwhile, Penny is forced to take in Sheldon after he locks himself out of his apartment.",Big Bang Theory
112,The Classified Materials Turbulence,Penny's second date with Stuart has significant implications for Leonard. Howard enlists the guys' help with one of his NASA projects.,Big Bang Theory
113,The Monopolar Expedition,Penny gets upset when she finds out Leonard and the guys plan to work at the North Pole for the summer.,Big Bang Theory
114,The Electric Can Opener Fluctuation,"After returning from the North Pole, a conflict among the guys sends Sheldon back to Texas and interferes with Leonard's reunion with Penny.",Big Bang Theory
115,The Jiminy Conjecture,Leonard and Penny's first night together goes awkwardly. Sheldon and Howard wager on the species of a cricket.,Big Bang Theory
116,The Gothowitz Deviation,"Sheldon attempts to covertly alter Penny's habits, while Howard and Raj try their luck meeting women at a Goth-style club.",Big Bang Theory
117,The Pirate Solution,"When Raj has to find a new job or be sent back to India, Sheldon's solution leaves Leonard and Penny dealing with Howard as the third wheel.",Big Bang Theory
118,The Creepy Candy Coating Corollary,"Leonard is forced to ask Penny to set Howard up with one of her friends, while Sheldon seeks payback against sci-fi star Wil Wheaton.",Big Bang Theory
119,The Cornhusker Vortex,"Leonard tries to learn about football to fit in with Penny's friends. Meanwhile, a loss in a kite war threatens to end Raj and Howard's friendship.",Big Bang Theory
120,The Guitarist Amplification,Sheldon is caught in the middle when Leonard and Penny argue about Penny's friend staying at her apartment.,Big Bang Theory
121,The Adhesive Duck Deficiency,"Penny is forced to turn to Sheldon for help when she dislocates her shoulder in the bathtub. Meanwhile, the rest of the guys accidentally get stoned in the desert while waiting for a meteor shower.",Big Bang Theory
122,The Vengeance Formulation,Sheldon plans revenge after Kripke humiliates him on the radio. Howard develops doubts about his relationship with Bernadette.,Big Bang Theory
123,The Gorilla Experiment,"Sheldon attempts to help Penny understand physics to impress Leonard, while Howard becomes jealous when Bernadette takes an interest in Leonard's research.",Big Bang Theory
124,The Maternal Congruence,Leonard's mother makes a visit to his dismay and Sheldon's delight.,Big Bang Theory
125,The Psychic Vortex,Raj talks Sheldon into being his wingman at a university mixer. Leonard has trouble dealing with Penny consulting a psychic.,Big Bang Theory
126,The Bozeman Reaction,"When their apartment is robbed, Leonard and Sheldon turn to Howard and Raj to create a state-of-the-art security system.",Big Bang Theory
127,The Einstein Approximation,Sheldon wreaks havoc when he is stumped by a difficult physics question.,Big Bang Theory
128,The Large Hadron Collision,"When Leonard is offered a trip to Switzerland on Valentine's Day to visit the CERN laboratory, Sheldon uses any and all means to be his guest instead of Penny.",Big Bang Theory
